<?xml version="1.0" encoding="UTF-8"?>

<iskola xmlns:xs="http://www.w3.org/2001/XMLSchema-instance"
 xs:noNamespaceSchemaLocation="XMLSchemaFeu2e5.xsd">

<!--Diákok-->
<diák Dkód="10" szülő="100" tagság="1000">
    <név>Kiss Attila</név>
    <IQ>90</IQ>
    <születési_dátum>2016-12-17</születési_dátum>
    <nem>fiú</nem>
</diák>
<diák Dkód="11" szülő="110" tagság="1001">
    <név>Nagy Mária</név>
    <IQ>65</IQ>
    <születési_dátum>2016-10-15</születési_dátum>
    <nem>lány</nem>
</diák>
<diák Dkód="12" szülő="120" tagság="1002">
    <név>Szép Tamás</név>
    <IQ>110</IQ>
    <születési_dátum>2016-06-06</születési_dátum>
    <nem>fiú</nem>
</diák>
<diák Dkód="13" szülő="120" tagság="1003">
    <név>Szép Anita</név>
    <IQ>115</IQ>
    <születési_dátum>2016-01-05</születési_dátum>
    <nem>lány</nem>
</diák>

<!--tagság adatok-->
<tagság Tagkód="1000">
    <kezdőnap>2016-09-01</kezdőnap>
    <kedvezmény>normál</kedvezmény>
    <aktív>igen</aktív>
</tagság>
<tagság Tagkód="1001">
    <kezdőnap>2015-09-01</kezdőnap>
    <kedvezmény>kedvezményes</kedvezmény>
    <aktív>igen</aktív>
</tagság>
<tagság Tagkód="1002">
    <kezdőnap>2013-09-01</kezdőnap>
    <kedvezmény>normál</kedvezmény>
    <aktív>igen</aktív>
</tagság>
<tagság Tagkód="1003">
    <kezdőnap>2013-09-01</kezdőnap>
    <kedvezmény>kedvezményes</kedvezmény>
    <aktív>nem</aktív>
</tagság>

<!--szülők-->
<szülő Szkód="100">
    <név>Kiss Béla</név>
    <születési_év>1985</születési_év>
    <elérhetőség>
        <telefonszám>+36506060768</telefonszám>
        <email>belakiss@gmail.com</email>
        <email>kissbela@citromail.hu</email>
    </elérhetőség>
</szülő>
<szülő Szkód="110">
    <név>Nagy Adrienn</név>
    <születési_év>1991</születési_év>
    <elérhetőség>
        <telefonszám>+36701234987</telefonszám>
        <email>n.adrienn@gmail.com</email>
    </elérhetőség>
</szülő>
<szülő Szkód="120">
    <név>Szép János</név>
    <születési_év>1990</születési_év>
    <elérhetőség>
        <telefonszám>+36208877665</telefonszám>
        <email>szepjancsi@szepmail.hu</email>
        <email>jancsi.szep@gmail.com</email>
        <email>jancsi.szep@freemail.com</email>
    </elérhetőség>
</szülő>
<!--Órák-->
<óra Ókód="1200" tanár="1100">
    <téma>Matematika alapjai</téma>
    <helyszín>tanterem 101.</helyszín>
    <időpont>
        <dátum>2024-10-30</dátum>
        <kezdet>13</kezdet>
        <vég>14</vég>
    </időpont>
</óra>
<óra Ókód="1201" tanár="1100">
    <téma>osztás</téma>
    <téma>szorzás</téma>
    <helyszín>tanterem 2.</helyszín>
    <időpont>
        <dátum>2024-10-15</dátum>
        <kezdet>9</kezdet>
        <vég>10</vég>
    </időpont>
</óra>
<óra Ókód="1202" tanár="1101">
    <téma>Kidobós</téma>
    <téma>cooper teszt</téma>
    <helyszín>tornaterem</helyszín>
    <időpont>
        <dátum>2024-09-02</dátum>
        <kezdet>12</kezdet>
        <vég>13</vég>
    </időpont>
</óra>
<óra Ókód="1203" tanár="1102">
    <téma>fogócska</téma>
    <helyszín>udvar</helyszín>
    <időpont>
        <dátum>2024-11-25</dátum>
        <kezdet>11</kezdet>
        <vég>12</vég>
    </időpont>
</óra>

<!--Részvételi adatok-->
<részvétel diák="10" óra="1200">
    <értékelés>3</értékelés>
</részvétel>
<részvétel diák="10" óra="1201">
    <értékelés>4</értékelés>
    <jutalom>pirospont</jutalom>
</részvétel>
<részvétel diák="11" óra="1201">
    <értékelés>5</értékelés>
    <jutalom>matrica</jutalom>
</részvétel>
<részvétel diák="12" óra="1200">
    <értékelés>1</értékelés>
    <jutalom>feketepont</jutalom>
</részvétel>
<részvétel diák="12" óra="1202">
    <értékelés>3</értékelés>
</részvétel>
<részvétel diák="13" óra="1203">
    <értékelés>5</értékelés>
    <jutalom>pirospont</jutalom>
</részvétel>

<!--tanárok-->
<tanár Tankód="1100">
    <név>Takács Péter</név>
    <szakterület>Matematika</szakterület>
    <órabér>5000</órabér>
    <elérhetőség>
        <telefonszám>+36702525625</telefonszám>
        <email>t.p@gmail.com</email>
    </elérhetőség>
</tanár>
<tanár Tankód="1101">
    <név>Kovács Zoltán</név>
    <szakterület>Testnevelés</szakterület>
    <órabér>2500</órabér>
    <elérhetőség>
        <telefonszám>+36301233456</telefonszám>
        <email>kovizol@gmail.com</email>
        <email>kovacs.z@freemail.hu</email>
    </elérhetőség>
</tanár>
<tanár Tankód="1102">
    <név>Lédig Anna</név>
    <szakterület>Viselkedés Pszichológia</szakterület>
    <órabér>9500</órabér>
    <elérhetőség>
        <telefonszám>+36708996574</telefonszám>
        <email>ledig@gmail.com</email>
    </elérhetőség>
</tanár>


 </iskola>